question_num,question,context,response
20,In what way can a language model demonstrate meta-cognitive reasoning capabilities?,"plewis@fb.com
Abstract
Large pre-trained language models have been shown to store factual knowledge
in their parameters, and achieve state-of-the-art results when ﬁne-tuned on down-
stream NLP tasks. However, their ability to access and precisely manipulate knowl-
edge is still limited, and hence on knowledge-intensive tasks, their performance
lags behind task-speciﬁc architectures. Additionally, providing provenance for their

engineering. These models acquire predictive power regarding syntax, semantics, and ontologies inherent in human language corpora, but they also inherit inaccuracies and biases present in the data they are trained on.

shot multimodal reasoning with language. In The Eleventh International Conference on Learning
Representations, 2023. URL https://openreview.net/forum?id=G2Q2Mh3avow.
B. Zhang and R. Sennrich. Root mean square layer normalization. Advances in Neural Information
Processing Systems, 32, 2019.
W. X. Zhao, K. Zhou, J. Li, T. Tang, X. Wang, Y. Hou, Y. Min, B. Zhang, J. Zhang, Z. Dong, et al. A
survey of large language models. arXiv preprint arXiv:2303.18223, 2023.

Linguistics (Demonstrations), pages 48–53, Minneapolis, Minnesota, June 2019. Association
for Computational Linguistics. doi: 10.18653/v1/N19-4009. URL https://www.aclweb.
org/anthology/N19-4009.
[46] Ethan Perez, Siddharth Karamcheti, Rob Fergus, Jason Weston, Douwe Kiela, and Kyunghyun
Cho. Finding generalizable evidence by learning to convince q&a models. In Proceedings
of the 2019 Conference on Empirical Methods in Natural Language Processing and the 9th","ANSWER: I don't have enough information from the provided context to determine how a language model could demonstrate meta-cognitive reasoning capabilities. Meta-cognition refers to an individual's thought processes related to cognition itself—that is, thinking about thinking. This concept includes self-awareness, planning, monitoring, and evaluation of one's own cognitive processes. While it is known that these models can learn from vast amounts of data, understand syntactic and semantic structures, and even handle multi-modal reasoning, there seems to be no mention in the given context about them demonstrating metacognitive abilities such as introspection or self-evaluation."
